{
"canonical_url": "pentagi.com",
"category": "Open-source project",
"classification": {
"matched": {
"business": [
"automation"
],
"cybersecurity": [
"penetration",
"security"
]
},
"taxonomy_version": "sar-taxonomy-1.0"
},
"commercial": false,
"compliance": [],
"deployment": "self-hosted",
"description": "Fully autonomous AI Agents system capable of performing complex penetration testing tasks",
"disclaimer": "Reference implementation by Hemant Naik. Compliance information is compiled from the sources shown as of the date shown. It is not an assessment, certification, legal opinion or recommendation. Confirm current status with the vendor and the issuing body.",
"domains": {
"business": {
"components": {
"adoption": 26.15,
"docs": 7.0,
"domain_fit": 34.0,
"ecosystem": 3.0,
"governance": null,
"health": 20.0,
"trust": 16.0
},
"components_version": "components-from-signals-1.0",
"confidence": 0.34,
"evidence_coverage": 0.944,
"governance_credited": {},
"profile": "general",
"rank": null,
"score": 65.0,
"score_version": "sar-score-2.0",
"source": "classifier",
"unknown": [
"governance"
]
},
"cybersecurity": {
"components": {
"adoption": 26.15,
"docs": 7.0,
"domain_fit": 56.4,
"ecosystem": 3.0,
"governance": null,
"health": 20.0,
"trust": 16.0
},
"components_version": "components-from-signals-1.0",
"confidence": 0.564,
"evidence_coverage": 0.9,
"governance_credited": {},
"profile": "security",
"rank": null,
"score": 62.4,
"score_version": "sar-score-2.0",
"source": "classifier",
"unknown": [
"governance"
]
}
},
"external_ids": {
"github": "vxcontrol/pentagi"
},
"first_seen": "2026-10-26T12:12:45Z",
"governance": {
"certification_disclaimer": true,
"claims": [],
"evidence_urls": []
},
"id": "res_eea84cdf93e10282",
"identity": {
"evidence": [
"repository_ownership"
],
"rules_version": "identity-1.1",
"tier": 3
},
"issues": {
"advisories": 0,
"cves": 0,
"incidents": 0,
"links": [],
"regulator_actions": 0,
"withdrawn_certificates": 0
},
"last_seen": "2026-10-26T12:12:45Z",
"license": "MIT",
"name": "pentagi",
"news": [
{
"cluster_size": 1,
"date": "2026-10-05T06:59:50Z",
"headline": "pentagi release v2.2.0",
"kind": "vendor",
"link_confidence": 1.0,
"outlet": "GitHub releases",
"summary": "---\r\n\r\n<div align=\"center\">\r\n\r\n**PentAGI 2.2 — Any Modern LLM, a Contained Sandbox, Unified Web Search, and Multi-Instance Deployment**\r\n\r\nThis release supports the current generation of LLMs with a tested configuration for every provider,",
"tag": "product_update",
"url": "https://github.com/vxcontrol/pentagi/releases/tag/v2.2.0"
}
],
"news_checked": true,
"protocols": {
"a2a": {
"checked_at": "2026-10-26T12:23:43Z",
"parser_version": "a2a-0.3+1.0",
"status": "not_found"
},
"ard": {
"checked_at": "2026-10-26T12:23:41Z",
"parser_version": "ard-0.91",
"status": "not_found"
},
"mcp": {
"checked_at": "2026-10-26T12:23:44Z",
"parser_version": "mcp-2025-06-18",
"status": "not_found"
}
},
"publisher_domain": "pentagi.com",
"resource_type": "agent",
"scope": "public",
"signals": {
"github_archived": false,
"github_created_at": "2025-01-06T22:22:48Z",
"github_forks": 5045,
"github_language": "Go",
"github_open_issues": 58,
"github_pushed_at": "2026-10-22T23:26:13Z",
"github_stars": 32467,
"github_topic": "ai-agents",
"homepage": "https://pentagi.com"
},
"slug": "vxcontrol-pentagi",
"sources": [
{
"payload_hash": "dcf9ecdde80ebf86aa81a99729d666b5b858d4e062bac229e5ac76bf5529d6bf",
"retrieved_at": "2026-10-26T12:12:45Z",
"system": "github",
"url": "https://github.com/vxcontrol/pentagi"
}
],
"tags": [
"ai-agents",
"ai-security-tool",
"anthropic",
"autonomous-agents",
"golang",
"gpt",
"graphql",
"multi-agent-system",
"offensive-security",
"open-source",
"openai",
"penetration-testing",
"penetration-testing-tools",
"react",
"security-automation",
"security-testing",
"security-tools",
"self-hosted"
],
"tenant": null,
"traces": [],
"trust": {
"compliance": 5,
"identity": 3,
"issues": 1,
"protocols": 5,
"security": null,
"traces": 5,
"vendor_compliance": null
},
"url": "https://pentagi.com",
"vendor": "vxcontrol"
}