{
"canonical_url": "github.com/mintplex-labs/anything-llm",
"capabilities": [],
"category": "Workspace agent/RAG app",
"commercial": false,
"compliance": [],
"deployment": "GitHub; desktop/self-hosted",
"description": "Widely used self-hosted AI workspace with agent/tool capabilities.",
"disclaimer": "Reference implementation by Hemant Naik. Compliance information is compiled from the sources shown as of the date shown. It is not an assessment, certification, legal opinion or recommendation. Confirm current status with the vendor and the issuing body.",
"domains": {
"business": {
"components": {
"adoption": 25.0,
"docs": 9.0,
"domain_fit": 99.0,
"ecosystem": 13.0,
"governance": null,
"health": 19.0,
"trust": 16.0
},
"components_version": "components-from-signals-1.0",
"confidence": 1.0,
"evidence_coverage": 0.944,
"governance_credited": {},
"profile": "general",
"rank": 96,
"recomputed": 84.9,
"score": 78.8,
"score_version": "sar-score-2.0",
"seed_rank": 96,
"seed_score": 84.9,
"source": "seed_xlsx",
"unknown": [
"governance"
]
},
"data": {
"components": {
"adoption": 25.0,
"docs": 9.0,
"domain_fit": 99.0,
"ecosystem": 13.0,
"governance": null,
"health": 19.0,
"trust": 16.0
},
"components_version": "components-from-signals-1.0",
"confidence": 1.0,
"evidence_coverage": 1.0,
"governance_credited": {},
"profile": "data",
"rank": 32,
"recomputed": 88.3,
"score": 85.0,
"score_version": "sar-score-2.0",
"seed_rank": 32,
"seed_score": 88.3,
"source": "seed_xlsx",
"unknown": [
"governance"
]
}
},
"external_ids": {
"github": "Mintplex-Labs/anything-llm"
},
"first_seen": "2026-10-11T19:09:17Z",
"governance": {
"certification_disclaimer": true,
"claims": [],
"evidence_urls": []
},
"id": "res_fe9618cd7bac5348",
"identity": {
"evidence": [
"repository_ownership"
],
"rules_version": "identity-1.1",
"tier": 3
},
"issues": {
"advisories": 0,
"cves": 25,
"incidents": 0,
"links": [
{
"date": "2024-01-19",
"kind": "cve",
"title": "CVE-2024-22422",
"url": "https://nvd.nist.gov/vuln/detail/CVE-2024-22422"
},
{
"date": "2024-02-26",
"kind": "cve",
"title": "CVE-2024-0455",
"url": "https://nvd.nist.gov/vuln/detail/CVE-2024-0455"
},
{
"date": "2024-02-27",
"kind": "cve",
"title": "CVE-2024-0759",
"url": "https://nvd.nist.gov/vuln/detail/CVE-2024-0759"
},
{
"date": "2024-03-03",
"kind": "cve",
"title": "CVE-2024-0765",
"url": "https://nvd.nist.gov/vuln/detail/CVE-2024-0765"
},
{
"date": "2024-04-10",
"kind": "cve",
"title": "CVE-2024-3570",
"url": "https://nvd.nist.gov/vuln/detail/CVE-2024-3570"
},
{
"date": "2025-03-20",
"kind": "cve",
"title": "CVE-2024-13060",
"url": "https://nvd.nist.gov/vuln/detail/CVE-2024-13060"
},
{
"date": "2025-12-18",
"kind": "cve",
"title": "CVE-2025-63390",
"url": "https://nvd.nist.gov/vuln/detail/CVE-2025-63390"
},
{
"date": "2026-01-03",
"kind": "cve",
"title": "CVE-2026-21484",
"url": "https://nvd.nist.gov/vuln/detail/CVE-2026-21484"
},
{
"date": "2026-01-27",
"kind": "cve",
"title": "CVE-2026-24477",
"url": "https://nvd.nist.gov/vuln/detail/CVE-2026-24477"
},
{
"date": "2026-01-27",
"kind": "cve",
"title": "CVE-2026-24478",
"url": "https://nvd.nist.gov/vuln/detail/CVE-2026-24478"
}
],
"regulator_actions": 0,
"withdrawn_certificates": 0
},
"last_seen": "2026-10-11T19:10:14Z",
"license": "MIT",
"merged_ids": [
"res_5501dfa82f982555"
],
"name": "AnythingLLM",
"news": [
{
"cluster_size": 1,
"date": "2026-10-01T22:17:40Z",
"headline": "anything-llm: AnythingLLM v1.17.0",
"kind": "vendor",
"link_confidence": 1.0,
"outlet": "GitHub releases",
"summary": "## What's Changed\r\n* fix(collector): read spreadsheet dates as dates, not serial numbers by @L4XB in https://github.com/Mintplex-Labs/anything-llm/pull/6478\r\n* Drop temp param for Anthropic models by @shatfield4 in https://github.com/Mintpl",
"tag": "product_update",
"url": "https://github.com/Mintplex-Labs/anything-llm/releases/tag/v1.17.0"
},
{
"cluster_size": 1,
"date": "2026-09-22T19:06:03Z",
"headline": "anything-llm: AnythingLLM v1.16.2",
"kind": "vendor",
"link_confidence": 1.0,
"outlet": "GitHub releases",
"summary": "## New Features\r\n\r\n- [x] [LLMman - OSS](https://github.com/llmmanorg/llmman) is now available as a local LLM provider, replacing Docker Model Runner\r\n- [x] [Google Vertex AI](https://cloud.google.com/products/gemini-enterprise-agent-platfor",
"tag": "product_update",
"url": "https://github.com/Mintplex-Labs/anything-llm/releases/tag/v1.16.2"
}
],
"news_checked": true,
"protocols": {
"a2a": {
"checked_at": "2026-10-11T19:17:04Z",
"parser_version": "a2a-0.3+1.0",
"status": "not_found"
},
"ard": {
"checked_at": "2026-10-11T19:17:03Z",
"parser_version": "ard-0.91",
"status": "not_found"
},
"mcp": {
"checked_at": "2026-10-11T19:17:04Z",
"parser_version": "mcp-2025-06-18",
"status": "not_found"
}
},
"publisher_domain": "anythingllm.com",
"resource_type": "agent",
"scope": "public",
"security": {
"advisories": 0,
"checked_at": "2026-10-11T19:28:49Z",
"cves": 25,
"source": "nvd",
"tier": 1
},
"seed": {
"last_verified": "2026-09-25",
"snapshot_date": "2026-09-25"
},
"seed_components": {
"adoption": 25.0,
"docs": 9.0,
"domain_fit": 99.0,
"ecosystem": 13.0,
"governance": 45.0,
"health": 19.0,
"trust": 20.0
},
"signals": {
"github_archived": false,
"github_created_at": "2023-06-04T02:29:14Z",
"github_forks": 7470,
"github_language": "JavaScript",
"github_open_issues": 334,
"github_pushed_at": "2026-10-09T15:18:53Z",
"github_stars": 66943,
"github_topic": "ai-agents",
"homepage": "https://anythingllm.com",
"observed_popularity": "Not captured",
"seed_enrich": {
"changed": [
"publisher_domain",
"tags"
],
"repo": "Mintplex-Labs/anything-llm"
}
},
"slug": "mintplex-labs-anythingllm",
"sources": [
{
"payload_hash": "8edac3990455ecf22a7860b53cba3a1fda1b055e53958ebcc26ab75c0f5faff3",
"retrieved_at": "2026-10-11T19:09:17Z",
"system": "seed_xlsx",
"url": "https://github.com/Mintplex-Labs/anything-llm"
},
{
"payload_hash": "e5dfb00a509707319edb3776ae36dcf39dba80b19e17c72a227cce8c0ad80eea",
"retrieved_at": "2026-10-11T19:10:14Z",
"system": "github",
"url": "https://github.com/Mintplex-Labs/anything-llm"
}
],
"tags": [
"agent-computer",
"agent-harness",
"agent-orchestration",
"agentic-ai",
"agentic-workflow",
"ai-agents",
"computer-use",
"hermes-agent",
"llm",
"local-ai",
"localai",
"multimodal",
"rag",
"self-hosted-ai",
"vector-database"
],
"tenant": null,
"traces": [],
"trust": {
"compliance": 5,
"identity": 3,
"issues": 3,
"protocols": 5,
"security": 1,
"traces": 5,
"vendor_compliance": null
},
"url": "https://github.com/Mintplex-Labs/anything-llm",
"vendor": "Mintplex Labs"
}