{
"canonical_url": "openstatus.dev",
"category": "Open-source project",
"classification": {
"matched": {
"cybersecurity": [
"incident"
],
"technology": [
"code",
"mcp"
]
},
"taxonomy_version": "sar-taxonomy-1.0"
},
"commercial": false,
"compliance": [
{
"certificate_id": null,
"covers_resource": "unknown",
"credited": false,
"detail": {
"pages_visited": 5
},
"display": "Vendor-claimed (vendor page, 2026-10-25)",
"evidence_url": "https://www.openstatus.dev/",
"framework": "dora",
"issued": null,
"issuer": null,
"match_confidence": 1.0,
"next_check": "2026-11-01",
"payload_hash": "f5abc7ac524e7ef0966997aeb1f6cc34c14e04dc7c058275588de25e566bc1d1",
"period_end": null,
"retrieved_at": "2026-10-25T18:11:44Z",
"review_reason": "framework named on the vendor's own page",
"reviewer": null,
"scope": "entity",
"source": "vendor_trust_centers",
"status": "active",
"tier": 4,
"valid_until": null,
"variant": null
},
{
"certificate_id": null,
"covers_resource": "unknown",
"credited": false,
"detail": {
"pages_visited": 5
},
"display": "Vendor-claimed (vendor page, 2026-10-25)",
"evidence_url": "https://www.openstatus.dev/privacy",
"framework": "gdpr",
"issued": null,
"issuer": null,
"match_confidence": 1.0,
"next_check": "2026-11-01",
"payload_hash": "a98938a0b908a4742051826551c242a57dcd86dcdf6be8d376fba911422d2fc0",
"period_end": null,
"retrieved_at": "2026-10-25T18:11:44Z",
"review_reason": "framework named on the vendor's own page",
"reviewer": null,
"scope": "entity",
"source": "vendor_trust_centers",
"status": "active",
"tier": 4,
"valid_until": null,
"variant": null
},
{
"certificate_id": null,
"covers_resource": "unknown",
"credited": false,
"detail": {
"pages_visited": 5
},
"display": "ISO 27001: Vendor-claimed (vendor page, 2026-10-25)",
"evidence_url": "https://www.openstatus.dev/",
"framework": "iso27001",
"issued": null,
"issuer": null,
"match_confidence": 1.0,
"next_check": "2026-11-01",
"payload_hash": "f5abc7ac524e7ef0966997aeb1f6cc34c14e04dc7c058275588de25e566bc1d1",
"period_end": null,
"retrieved_at": "2026-10-25T18:11:44Z",
"review_reason": "framework named on the vendor's own page",
"reviewer": null,
"scope": "entity",
"source": "vendor_trust_centers",
"status": "active",
"tier": 4,
"valid_until": null,
"variant": "ISO27001"
},
{
"certificate_id": null,
"covers_resource": "unknown",
"credited": false,
"detail": {
"pages_visited": 5
},
"display": "Vendor-claimed (vendor page, 2026-10-25)",
"evidence_url": "https://www.openstatus.dev/",
"framework": "soc2",
"issued": null,
"issuer": null,
"match_confidence": 1.0,
"next_check": "2026-11-01",
"payload_hash": "f5abc7ac524e7ef0966997aeb1f6cc34c14e04dc7c058275588de25e566bc1d1",
"period_end": null,
"retrieved_at": "2026-10-25T18:11:44Z",
"review_reason": "framework named on the vendor's own page",
"reviewer": null,
"scope": "entity",
"source": "vendor_trust_centers",
"status": "active",
"tier": 4,
"valid_until": null,
"variant": null
},
{
"certificate_id": null,
"covers_resource": "unknown",
"credited": false,
"detail": {
"pages_visited": 5
},
"display": "SOC 2 Type II: Vendor-claimed (vendor page, 2026-10-25)",
"evidence_url": "https://www.openstatus.dev/use-case/compliance",
"framework": "soc2",
"issued": null,
"issuer": null,
"match_confidence": 1.0,
"next_check": "2026-11-01",
"payload_hash": "e4e8126443c1c8b4b2d58da98ba76918611579450d1a0e1176ecc98c926ab92c",
"period_end": null,
"retrieved_at": "2026-10-25T18:11:44Z",
"review_reason": "framework named on the vendor's own page",
"reviewer": null,
"scope": "entity",
"source": "vendor_trust_centers",
"status": "active",
"tier": 4,
"valid_until": null,
"variant": "SOC2_TYPE_II"
}
],
"deployment": "self-hosted",
"description": "Open-source status page, incident response and uptime monitoring",
"disclaimer": "Reference implementation by Hemant Naik. Compliance information is compiled from the sources shown as of the date shown. It is not an assessment, certification, legal opinion or recommendation. Confirm current status with the vendor and the issuing body.",
"domains": {
"cybersecurity": {
"components": {
"adoption": 22.98,
"docs": 7.0,
"domain_fit": 34.0,
"ecosystem": 6.6,
"governance": 0.0,
"health": 20.0,
"trust": 17.0
},
"components_version": "components-from-signals-1.0",
"confidence": 0.34,
"evidence_coverage": 1.0,
"governance_credited": {},
"profile": "security",
"rank": null,
"score": 60.3,
"score_version": "sar-score-2.0",
"source": "classifier",
"unknown": []
},
"technology": {
"components": {
"adoption": 22.98,
"docs": 7.0,
"domain_fit": 56.4,
"ecosystem": 6.6,
"governance": 0.0,
"health": 20.0,
"trust": 17.0
},
"components_version": "components-from-signals-1.0",
"confidence": 0.564,
"evidence_coverage": 1.0,
"governance_credited": {},
"profile": "technology",
"rank": null,
"score": 72.3,
"score_version": "sar-score-2.0",
"source": "classifier",
"unknown": []
}
},
"external_ids": {
"github": "openstatusHQ/openstatus"
},
"first_seen": "2026-10-25T18:00:16Z",
"governance": {
"certification_disclaimer": true,
"claims": [],
"evidence_urls": []
},
"id": "res_f67b9608118688ae",
"identity": {
"evidence": [
"repository_ownership"
],
"rules_version": "identity-1.1",
"tier": 3
},
"issues": {
"advisories": 0,
"cves": 2,
"incidents": 0,
"links": [
{
"date": "2026-04-08",
"kind": "cve",
"title": "CVE-2026-5808",
"url": "https://nvd.nist.gov/vuln/detail/CVE-2026-5808"
},
{
"date": "2026-09-12",
"kind": "cve",
"title": "CVE-2026-90486",
"url": "https://nvd.nist.gov/vuln/detail/CVE-2026-90486"
}
],
"regulator_actions": 0,
"withdrawn_certificates": 0
},
"last_seen": "2026-10-25T18:00:16Z",
"license": "AGPL-3.0",
"name": "openstatus",
"news": [],
"news_checked": true,
"protocols": {
"a2a": {
"checked_at": "2026-10-25T18:05:41Z",
"parser_version": "a2a-0.3+1.0",
"status": "not_found"
},
"ard": {
"checked_at": "2026-10-25T18:05:39Z",
"parser_version": "ard-0.91",
"status": "not_found"
},
"mcp": {
"evidence_url": "https://openstatus.dev",
"note": "named in the resource's own tags",
"probe": {
"card_url": "https://www.openstatus.dev/.well-known/mcp.json",
"checked_at": "2026-10-25T18:05:42Z",
"status": "invalid"
},
"source": "self_description",
"status": "claimed"
}
},
"publisher_domain": "openstatus.dev",
"resource_type": "mcp_server",
"scope": "public",
"security": {
"advisories": 0,
"checked_at": "2026-10-25T18:21:48Z",
"cves": 2,
"source": "nvd",
"tier": 1
},
"signals": {
"github_archived": false,
"github_created_at": "2023-06-19T15:32:41Z",
"github_forks": 796,
"github_language": "TypeScript",
"github_open_issues": 104,
"github_pushed_at": "2026-10-25T13:09:23Z",
"github_stars": 9228,
"github_topic": "mcp-server",
"homepage": "https://openstatus.dev"
},
"slug": "openstatushq-openstatus",
"sources": [
{
"payload_hash": "1d7f7007fb39231e0b8ff403eb22651bd23d59d9a555ef84147419f910f7c1a1",
"retrieved_at": "2026-10-25T18:00:16Z",
"system": "github",
"url": "https://github.com/openstatusHQ/openstatus"
}
],
"tags": [
"alerting",
"incident-management",
"mcp",
"mcp-server",
"monitoring",
"monitoring-as-code",
"observability",
"on-call",
"open-source",
"sre",
"status-page",
"statuspage",
"synthetic-monitoring",
"terraform",
"tinybird",
"turso",
"uptime",
"uptime-checker",
"uptime-monitor"
],
"tenant": null,
"traces": [],
"trust": {
"compliance": 5,
"identity": 3,
"issues": 3,
"protocols": 3,
"security": 1,
"traces": 5,
"vendor_compliance": 4
},
"url": "https://openstatus.dev",
"vendor": "openstatusHQ"
}