{
"canonical_url": "plandex.ai",
"category": "Open-source project",
"classification": {
"matched": {
"technology": [
"cli",
"coding",
"developer",
"git",
"llm",
"programming",
"terminal"
]
},
"taxonomy_version": "sar-taxonomy-1.0"
},
"commercial": false,
"compliance": [],
"deployment": "self-hosted",
"description": "Open source AI coding agent. Designed for large projects and real world tasks.",
"disclaimer": "Reference implementation by Hemant Naik. Compliance information is compiled from the sources shown as of the date shown. It is not an assessment, certification, legal opinion or recommendation. Confirm current status with the vendor and the issuing body.",
"domains": {
"technology": {
"components": {
"adoption": 24.31,
"docs": 7.0,
"domain_fit": 94.5,
"ecosystem": 3.0,
"governance": null,
"health": 8.0,
"trust": 16.0
},
"components_version": "components-from-signals-1.0",
"confidence": 0.945,
"evidence_coverage": 1.0,
"governance_evidence": {
"credited": {},
"score": null,
"value": null,
"version": "sar-score-1.1"
},
"profile": "technology",
"rank": null,
"score": 61.1,
"score_version": "sar-score-1.0",
"source": "classifier",
"unknown": [
"governance"
]
}
},
"external_ids": {
"github": "plandex-ai/plandex"
},
"first_seen": "2026-09-28T23:19:13Z",
"governance": {
"certification_disclaimer": true,
"claims": [],
"evidence_urls": []
},
"id": "res_9b1e9913a537d0a7",
"identity": {
"evidence": [
"repository_ownership"
],
"rules_version": "identity-1.0",
"tier": 3
},
"issues": {
"advisories": 0,
"cves": 0,
"incidents": 0,
"links": [],
"regulator_actions": 0,
"withdrawn_certificates": 0
},
"last_seen": "2026-09-28T23:19:13Z",
"license": "MIT",
"name": "plandex",
"news": [],
"protocols": {
"a2a": {
"checked_at": "2026-09-28T23:27:55Z",
"parser_version": "a2a-0.3+1.0",
"status": "not_found"
},
"ard": {
"checked_at": "2026-09-28T23:27:16Z",
"parser_version": "ard-0.91",
"status": "not_found"
},
"mcp": {
"status": "unknown"
}
},
"publisher_domain": "plandex.ai",
"resource_type": "agent",
"scope": "public",
"signals": {
"github_archived": false,
"github_created_at": "2023-10-24T22:11:43Z",
"github_forks": 1178,
"github_language": "Go",
"github_open_issues": 66,
"github_pushed_at": "2025-10-03T21:49:58Z",
"github_stars": 15673,
"github_topic": "ai-agents",
"homepage": "https://plandex.ai"
},
"slug": "plandex-ai-plandex",
"sources": [
{
"payload_hash": "37b4825978894c66fc4851cd8d2bf3c5863c0854ec564513f68a7d4b69f21fb2",
"retrieved_at": "2026-09-28T23:19:13Z",
"system": "github",
"url": "https://github.com/plandex-ai/plandex"
}
],
"tags": [
"ai",
"ai-agents",
"ai-developer-tools",
"ai-tools",
"cli",
"command-line",
"developer-tools",
"git",
"golang",
"gpt-4",
"llm",
"openai",
"polyglot-programming",
"terminal",
"terminal-based",
"terminal-ui"
],
"tenant": null,
"trust": {
"compliance": 5,
"identity": 3,
"issues": null,
"protocols": 5,
"security": null
},
"url": "https://plandex.ai",
"vendor": "plandex-ai"
}