{
"canonical_url": "graphify.com",
"category": "Open-source project",
"classification": {
"matched": {
"business": [
"knowledge"
],
"data": [
"knowledge graph",
"rag",
"search",
"sql",
"vector"
],
"technology": [
"cli",
"code",
"developer",
"llm",
"mcp"
]
},
"taxonomy_version": "sar-taxonomy-1.0"
},
"commercial": false,
"compliance": [
{
"certificate_id": null,
"covers_resource": "unknown",
"credited": true,
"detail": {
"pages_visited": 5
},
"display": "DPA available: Vendor-claimed (vendor page, 2026-10-25)",
"evidence_url": "https://graphify.com/privacy",
"framework": "gdpr",
"issued": null,
"issuer": null,
"match_confidence": 1.0,
"next_check": "2026-11-01",
"payload_hash": "642af579a784cc1c17102afaaf599c1c4527ed8e356ee2c5e6e3b8cdf7426034",
"period_end": null,
"retrieved_at": "2026-10-25T18:10:55Z",
"review_reason": "framework named on the vendor's own page",
"reviewer": null,
"scope": "entity",
"source": "vendor_trust_centers",
"status": "active",
"tier": 4,
"valid_until": null,
"variant": "DPA_AVAILABLE"
},
{
"certificate_id": null,
"covers_resource": "unknown",
"credited": true,
"detail": {
"pages_visited": 5
},
"display": "SOC 2 Type II: Vendor-claimed (vendor page, 2026-10-25)",
"evidence_url": "https://graphify.com/",
"framework": "soc2",
"issued": null,
"issuer": null,
"match_confidence": 1.0,
"next_check": "2026-11-01",
"payload_hash": "041c36b33a966e759bb127b2ba45ce8cde8be5072d13e0137c229fb9e3b7a7e4",
"period_end": null,
"retrieved_at": "2026-10-25T18:10:55Z",
"review_reason": "framework named on the vendor's own page",
"reviewer": null,
"scope": "entity",
"source": "vendor_trust_centers",
"status": "active",
"tier": 4,
"valid_until": null,
"variant": "SOC2_TYPE_II"
}
],
"deployment": "self-hosted",
"description": "Turn any codebase, with its docs, SQL schemas, configs, and PDFs, into a queryable knowledge graph. A /graphify skill for Claude Code, Cursor, Codex, and Gemini CLI: local deterministic AST parsing, every edge explained, no vector store.",
"disclaimer": "Reference implementation by Hemant Naik. Compliance information is compiled from the sources shown as of the date shown. It is not an assessment, certification, legal opinion or recommendation. Confirm current status with the vendor and the issuing body.",
"domains": {
"business": {
"components": {
"adoption": 29.73,
"docs": 7.0,
"domain_fit": 34.0,
"ecosystem": 6.6,
"governance": 3.8,
"health": 20.0,
"trust": 20.0
},
"components_version": "components-from-signals-1.0",
"confidence": 0.34,
"evidence_coverage": 1.0,
"governance_credited": {
"soc2": 0.15
},
"profile": "general",
"rank": null,
"score": 74.7,
"score_version": "sar-score-2.0",
"source": "classifier",
"unknown": []
},
"data": {
"components": {
"adoption": 29.73,
"docs": 7.0,
"domain_fit": 87.5,
"ecosystem": 6.6,
"governance": 3.0,
"health": 20.0,
"trust": 20.0
},
"components_version": "components-from-signals-1.0",
"confidence": 0.875,
"evidence_coverage": 1.0,
"governance_credited": {
"soc2": 0.15
},
"profile": "data",
"rank": null,
"score": 84.0,
"score_version": "sar-score-2.0",
"source": "classifier",
"unknown": []
},
"technology": {
"components": {
"adoption": 29.73,
"docs": 7.0,
"domain_fit": 87.5,
"ecosystem": 6.6,
"governance": 3.0,
"health": 20.0,
"trust": 20.0
},
"components_version": "components-from-signals-1.0",
"confidence": 0.875,
"evidence_coverage": 1.0,
"governance_credited": {
"soc2": 0.15
},
"profile": "technology",
"rank": null,
"score": 84.6,
"score_version": "sar-score-2.0",
"source": "classifier",
"unknown": []
}
},
"external_ids": {
"github": "Graphify-Labs/graphify"
},
"first_seen": "2026-10-25T17:55:30Z",
"governance": {
"certification_disclaimer": true,
"claims": [],
"evidence_urls": []
},
"id": "res_6e4fdf71068e2d65",
"identity": {
"evidence": [
"vendor_domain_product_page"
],
"rules_version": "identity-1.1",
"tier": 2
},
"issues": {
"advisories": 0,
"cves": 1,
"incidents": 0,
"links": [
{
"date": "2026-07-20",
"kind": "cve",
"title": "CVE-2026-51385",
"url": "https://nvd.nist.gov/vuln/detail/CVE-2026-51385"
}
],
"regulator_actions": 0,
"withdrawn_certificates": 0
},
"last_seen": "2026-10-25T17:55:30Z",
"license": "Apache-2.0",
"name": "graphify",
"news": [
{
"cluster_size": 1,
"date": "2026-10-23T17:59:38Z",
"headline": "graphify 0.9.95",
"kind": "vendor",
"link_confidence": 1.0,
"outlet": "GitHub releases",
"summary": "Twenty-one community pull requests. A security pass on install: the skill-install writes go through randomly-named temp files instead of predictable ones, so a pre-planted symlink can no longer redirect a write. Extraction: Python, Go, C++",
"tag": "product_update",
"url": "https://github.com/Graphify-Labs/graphify/releases/tag/v0.9.95"
},
{
"cluster_size": 1,
"date": "2026-10-22T16:19:50Z",
"headline": "graphify 0.9.94",
"kind": "vendor",
"link_confidence": 1.0,
"outlet": "GitHub releases",
"summary": "Nineteen community pull requests. A security pass on ingestion: a fetched URL with no hostname, with a malformed or zero port, or with embedded `user:pass@` credentials is now rejected before the request leaves, on the first fetch and on ev",
"tag": "product_update",
"url": "https://github.com/Graphify-Labs/graphify/releases/tag/v0.9.94"
},
{
"cluster_size": 1,
"date": "2026-10-14T15:00:41Z",
"discussion_url": "https://news.ycombinator.com/item?id=50088713",
"engagement": 63,
"headline": "Show HN: Graphicle, a Rust port of Graphify with memory for coding agents",
"kind": "community",
"link_confidence": 0.88,
"outlet": "Hacker News",
"summary": null,
"tag": "news",
"url": "https://github.com/graphicle-ai/graphicle"
},
{
"cluster_size": 1,
"date": "2026-09-22T16:46:31Z",
"discussion_url": "https://news.ycombinator.com/item?id=49804217",
"engagement": 16,
"headline": "Show HN: graf (1000x faster graphify in Rust)",
"kind": "community",
"link_confidence": 0.88,
"outlet": "Hacker News",
"summary": null,
"tag": "news",
"url": "https://github.com/ctxrs/graf"
},
{
"cluster_size": 1,
"date": "2026-09-12T00:16:10Z",
"discussion_url": "https://news.ycombinator.com/item?id=49667188",
"engagement": 66,
"headline": "Show HN: Graphify C# – Compiler-accurate Find Usages for coding agents",
"kind": "community",
"link_confidence": 0.88,
"outlet": "Hacker News",
"summary": null,
"tag": "news",
"url": "https://github.com/zachsaw/graphify-csharp"
}
],
"news_checked": true,
"protocols": {
"a2a": {
"checked_at": "2026-10-25T18:04:58Z",
"parser_version": "a2a-0.3+1.0",
"status": "not_found"
},
"ard": {
"checked_at": "2026-10-25T18:04:57Z",
"parser_version": "ard-0.91",
"status": "not_found"
},
"mcp": {
"evidence_url": "https://www.graphify.com",
"note": "named in the resource's own tags",
"probe": {
"checked_at": "2026-10-25T18:04:59Z",
"status": "not_found"
},
"source": "self_description",
"status": "claimed"
}
},
"publisher_domain": "graphify.com",
"resource_type": "skill",
"scope": "public",
"security": {
"advisories": 0,
"checked_at": "2026-10-25T18:19:10Z",
"cves": 1,
"source": "nvd",
"tier": 1
},
"signals": {
"github_archived": false,
"github_created_at": "2026-04-03T15:49:07Z",
"github_forks": 12883,
"github_language": "Python",
"github_open_issues": 1631,
"github_pushed_at": "2026-10-23T17:59:28Z",
"github_stars": 134975,
"github_topic": "ai-agents",
"homepage": "https://www.graphify.com"
},
"slug": "graphify-labs-graphify",
"sources": [
{
"payload_hash": "4f68625e4f0fa65e8931c3f7df84ef1d060fea67caf90e74492c804eae2400c8",
"retrieved_at": "2026-10-25T17:55:30Z",
"system": "github",
"url": "https://github.com/Graphify-Labs/graphify"
}
],
"tags": [
"ai-agents",
"antigravity",
"ast",
"claude-code",
"code-analysis",
"code-search",
"codex",
"cursor",
"developer-tools",
"gemini",
"graphify",
"graphrag",
"knowledge-graph",
"leiden",
"llm",
"mcp",
"openclaw",
"rag",
"skills",
"tree-sitter"
],
"tenant": null,
"traces": [],
"trust": {
"compliance": 5,
"identity": 2,
"issues": 3,
"protocols": 3,
"security": 1,
"traces": 5,
"vendor_compliance": 4
},
"url": "https://www.graphify.com",
"vendor": "Graphify-Labs"
}