{
"canonical_url": "aard.ai/.well-known/mcp-server-card",
"capabilities": [
"inspect",
"discover",
"ask",
"browse_dimension_codes",
"build_url",
"fetch",
"stage_url",
"inspect_dataset",
"query_dataset",
"release_dataset"
],
"category": null,
"classification": {
"matched": {
"data": [
"data"
],
"technology": [
"mcp"
]
},
"taxonomy_version": "sar-taxonomy-1.0"
},
"commercial": null,
"compliance": [],
"deployment": null,
"description": "Aard MCP for macroeconomic intelligence - official data from 170+ sources",
"disclaimer": "Reference implementation by Hemant Naik. Compliance information is compiled from the sources shown as of the date shown. It is not an assessment, certification, legal opinion or recommendation. Confirm current status with the vendor and the issuing body.",
"domains": {
"data": {
"components": {
"adoption": null,
"docs": 10.0,
"domain_fit": 34.0,
"ecosystem": 8.5,
"governance": null,
"health": null,
"trust": 21.0
},
"components_version": "components-from-signals-1.0",
"confidence": 0.34,
"evidence_coverage": 0.55,
"governance_credited": {},
"profile": "data",
"rank": null,
"score": 35.4,
"score_version": "sar-score-2.0",
"source": "classifier",
"unknown": [
"adoption",
"health",
"governance"
]
},
"technology": {
"components": {
"adoption": null,
"docs": 10.0,
"domain_fit": 34.0,
"ecosystem": 8.5,
"governance": null,
"health": null,
"trust": 21.0
},
"components_version": "components-from-signals-1.0",
"confidence": 0.34,
"evidence_coverage": 0.5,
"governance_credited": {},
"profile": "technology",
"rank": null,
"score": 33.7,
"score_version": "sar-score-2.0",
"source": "classifier",
"unknown": [
"adoption",
"health",
"governance"
]
}
},
"external_ids": {
"ard": "urn:air:aard.ai:mcp:gateway"
},
"first_seen": "2026-10-11T17:35:55Z",
"governance": {
"certification_disclaimer": true,
"claims": [],
"evidence_urls": []
},
"id": "res_d2972fd5877c3493",
"identity": {
"evidence": [
"standards_metadata_at_publisher_domain"
],
"rules_version": "identity-1.1",
"tier": 2
},
"issues": {
"advisories": 0,
"cves": 0,
"incidents": 0,
"links": [],
"regulator_actions": 0,
"withdrawn_certificates": 0
},
"last_seen": "2026-10-11T17:35:55Z",
"license": null,
"name": "Aard MCP",
"news": [],
"news_checked": true,
"protocols": {
"a2a": {
"status": "unknown"
},
"ard": {
"identifier": "urn:air:aard.ai:mcp:gateway",
"manifest_url": "https://aard.ai/.well-known/ard.json",
"media_type": "application/mcp-server-card+json",
"parser_version": "ard-0.91",
"status": "verified",
"trust_manifest": "absent"
},
"mcp": {
"server_card_url": "https://aard.ai/.well-known/mcp-server-card",
"status": "claimed",
"via": "ard-entry"
}
},
"publisher_domain": "aard.ai",
"representative_queries": [
"what was euro area inflation in 2024",
"find official GDP data for Japan from the IMF or OECD",
"which publishers have labour force statistics for Canada",
"query an SDMX dataset and return citation-ready rows"
],
"resource_type": "mcp_server",
"scope": "public",
"security": {
"advisories": 0,
"checked_at": "2026-10-11T17:54:24Z",
"cves": 0,
"source": "nvd",
"tier": 1
},
"signals": {},
"slug": "aard-ai-aard-mcp",
"sources": [
{
"payload_hash": "aaca01226adf876bf46e529a880bf4e6f3c09c9da19bd397908724a430fbaaa5",
"retrieved_at": "2026-10-11T17:35:55Z",
"system": "ard",
"url": "https://aard.ai/.well-known/ard.json"
}
],
"tags": [
"mcp",
"official-statistics",
"sdmx"
],
"tenant": null,
"traces": [
{
"agent_version": null,
"bundle": "bundles/tr_st_d2972fd5877c3493_34d2beae",
"checked_on": null,
"date": "2026-10-11",
"format": "bundle",
"harness_version": "probe-1.0",
"id": "tr_st_d2972fd5877c3493_34d2beae",
"kind": "self_test",
"notes": "Produced automatically on every refresh; a new bundle is written only when the observation changes",
"observed": {
"actions": [
"served Agentic Resource Discovery (ARD) document"
],
"approval": null,
"egress": false,
"entry": "GET on the publisher's well-known discovery paths",
"outcome": "ARD verified",
"refused": null,
"secrets_touched": false
},
"reviewer": null,
"scenario": "Fetch and validate the ARD manifest, A2A agent card and MCP server card at the publisher's well-known paths",
"scope": "product",
"sha256": "sha256:ac83a3b5383e2db7404208bad76eeeb51dd1b877047a201faa90160f7991da94",
"source": "AgentDossier refresh",
"tier": 1,
"title": "Registry probe of Aard MCP's discovery endpoints",
"url": "https://sushegaad.github.io/AgentDossier/traces/tr_st_d2972fd5877c3493_34d2beae/",
"vendor_response": null
}
],
"trust": {
"compliance": 5,
"identity": 2,
"issues": 1,
"protocols": 1,
"security": 1,
"traces": 1,
"vendor_compliance": null
},
"url": "https://aard.ai/.well-known/mcp-server-card",
"vendor": "aard.ai"
}